{
  "run_id": "frontforge-e2e-run-001",
  "status": "accepted",
  "iterations": {
    "total": 9,
    "by_agent": {
      "planner": 1,
      "designer": 1,
      "engineer": 1,
      "integration": 1,
      "qa": 4,
      "critic": 1
    }
  },
  "gates": {
    "build": {
      "passed": true,
      "evidence": "C:\\Users\\jayant\\Documents\\College\\Labrith\\docs\\evidence\\end-to-end\\artifacts\\frontforge-e2e-run-001\\T-02_build.log"
    },
    "tests": {
      "passed": true,
      "flows_passed": 4,
      "flows_total": 4
    },
    "accessibility": {
      "passed": true,
      "critical": 0,
      "serious": 0
    },
    "quality": {
      "lighthouse_accessibility": 92.0,
      "lighthouse_performance": 98.0
    },
    "integration": {
      "passed": true,
      "documented_mismatches": 0
    }
  },
  "unresolved": []
}